Country,Name Star,Citation Name Star,Name Exoplanet,Citation Name Exoplanet,Theme,Star catalog ID,Exoplanet catalog ID,Constelation,Star colour,Star type,Link to SIMBAD
Ukraine,Berehynia,"Berehynia was a Slavic deity of waters and riverbanks but in more recent times her status has been promoted to that of a national goddess — ""hearth mother, protectress of the earth"".",Tryzub,"Tryzub is the most recognised ancient symbol of Ukraine, that was minted on the coins of Prince Volodymyr the Great and today remains one of the country's state symbols (a small coat).",Names of ancient national symbols of the Ukrainian people.,HAT-P-15,HAT-P-15 b,Perseus,yellow,dwarf,http://simbad.u-strasbg.fr/simbad/sim-basic?Ident=HAT-P-15
United Arab Emirates,Sharjah,"Sharjah is the cultural capital of United Arab Emirates, and considered the city of knowledge due to its many educational centers, institutes, museums, libraries and heritage centers.",Barajeel,A barajeel is a wind tower used to direct the flow of the wind so that air can be recirculated as a form of air conditioning.,Names associated with the landmarks and architecture of the historical city of Sharjah in United Arab Emirates.,HIP 79431,HIP 79431 b,Scorpius,red,dwarf,http://simbad.u-strasbg.fr/simbad/sim-basic?Ident=HIP+79431
United Kingdom,Gloas,"In Manx Gaelic, Gloas means to shine (like a star).",Cruinlagh,"In Manx Gaelic, Cruinlagh means to orbit (like a planet around its star).","Terms referring to the physical processes of a planet or star in Manx Gaelic, a language spoken on the Isle of Man.",WASP-13,WASP-13 b,Lynx,yellow,dwarf,http://simbad.u-strasbg.fr/simbad/sim-basic?Ident=WASP-13
United States of America,Nushagak,"Nushagak is a regional river near Dilingham, Alaska, which is famous for its wild salmon that sustain local Indigenous communities.",Mulchatna,"The Mulchatna River is a tributary of the Nushagak River in southwestern Alaska, USA.","Names of rivers associated with the Bristol Bay watershed of southwestern Alaska, USA, famous for wild salmon which sustain local Indigenous communities.",HD 17156,HD 17156 b,Cassiopeia,yellow,dwarf,http://simbad.u-strasbg.fr/simbad/sim-basic?Ident=HD+17156
Uruguay,Ceibo,Ceibo is the name of the native tree of Uruguay that gives rise to the national flower.,Ibirapitá,"Ibirapitá is the name of a native tree that is characteristic of the country of Uruguay, and is also known as Artigas' tree, after the national hero.",Culturally significant species of trees native to Uruguay.,HD 63454,HD 63454 b,Chamaeleon,orange,dwarf,http://simbad.u-strasbg.fr/simbad/sim-basic?Ident=HD+63454
Zambia,Natasha,Natasha means thank you in many languages of Zambia.,Madalitso,Madalitso means blessings in the native language of Nyanja in Zambia.,Terms associated with appreciation and blessings in the languages of Zambia.,HD 85390,HD 85390 b,Vela,orange,dwarf,http://simbad.u-strasbg.fr/simbad/sim-basic?Ident=HD+85390
